writer,title,url,topic,type,date
Moez Ali,Understanding Data Drift and Model Drift: Drift Detection in Python,https://www.datacamp.com/tutorial/understanding-data-drift-model-drift,Machine Learning,blog,2023-01-11
DataCamp Team,G2 Names DataCamp as a Leader Across Enterprise and Mid-Market Course Providers,https://www.datacamp.com/blog/G2-Awards-22,For Business,blog,2023-01-05
DataCamp Team,if…elif…else in Python Tutorial ,https://www.datacamp.com/tutorial/elif-statements-python,Python,blog,2022-12-30
DataCamp Team,2022 Year In Review: DataCamp Customer Support,https://www.datacamp.com/blog/year-in-review-datacamp-customer-support,Life at DataCamp,blog,2022-12-30
Joleen Bothma,Julia vs R - Which Should You Learn? ,https://www.datacamp.com/blog/julia-vs-r-which-to-learn,R,blog,2022-12-29
Olivia Smith,Django Web Development in Python,https://www.datacamp.com/tutorial/web-development-django,Python,blog,2022-12-29
Javier Canales Luna,Python vs R for Data Science: Which Should You Learn?,https://www.datacamp.com/blog/python-vs-r-for-data-science-whats-the-difference,Python,blog,2022-12-28
Kurtis Pykes,Julia vs Python - Which Should You Learn?,https://www.datacamp.com/blog/julia-vs-python-which-to-learn,Julia,blog,2022-12-22
Aditya Sharma,How to Run Python Scripts Tutorial ,https://www.datacamp.com/tutorial/running-a-python-script,Python,blog,2022-12-21
Karlijn Willems,Pipes in R Tutorial For Beginners,https://www.datacamp.com/tutorial/pipe-r-tutorial,R,blog,2022-12-21
Abid Ali Awan,Python List Functions & Methods Tutorial and Examples,https://www.datacamp.com/tutorial/python-list-function,Python,blog,2022-12-19
Karlijn Willems,SQL Tutorial: How To Write Better Queries,https://www.datacamp.com/tutorial/sql-tutorial-query,SQL,blog,2022-12-19
Théo Vanderheyden,Object-Oriented Programming in Python (OOP): Tutorial,https://www.datacamp.com/tutorial/python-oop-tutorial,Python,blog,2022-12-19
Nathaniel Taylor-Leach,Education During the Time of a Pandemic: A Summary,https://www.datacamp.com/blog/education-during-the-time-of-a-pandemic,DataCamp Donates,blog,2022-12-16
Nathaniel Taylor-Leach,Give the Joy of Data to Yourself and Someone in Need this Holiday Season,https://www.datacamp.com/blog/give-the-joy-of-data-to-yourself-and-someone-in-need-this-holiday-season,DataCamp Donates,blog,2022-12-16
Javier Canales Luna,How to Write A Data Engineer Job Description,https://www.datacamp.com/blog/data-engineer-job-description,Career Services,blog,2022-12-16
Javier Canales Luna,How to Analyze Data For Your Business in 5 Steps,https://www.datacamp.com/blog/how-to-analyze-data-for-business,Data Analysis,blog,2022-12-15
DataCamp Team,DataCamp Content 2022: Year in Review,https://www.datacamp.com/blog/datacamp-content-year-in-review,Life at DataCamp,blog,2022-12-14
DataCamp Team,Python Sets and Set Theory Tutorial,https://www.datacamp.com/tutorial/sets-in-python,Python,blog,2022-12-13
Matt Crabtree,12 Days of Data Competitions ,https://www.datacamp.com/blog/12-days-of-data,Product News,blog,2022-12-12
Karlijn Willems,Pandas Tutorial: DataFrames in Python,https://www.datacamp.com/tutorial/pandas-tutorial-dataframe-python,Python,blog,2022-12-12
Adel Nehme,Top 2022 Resources to Sharpen your Data Skills,https://www.datacamp.com/blog/top-2022-resources-to-sharpen-your-data-skills,Data Science,blog,2022-12-09
Nathaniel Taylor-Leach,DataCampers Volunteer: Q3 2022,https://www.datacamp.com/blog/data-campers-volunteer-q3-2022,Life at DataCamp,blog,2022-12-09
Matt Crabtree,R vs SQL - Which Should I Learn?  ,https://www.datacamp.com/blog/r-vs-sql-which-to-choose,R,blog,2022-12-06
Zoumana Keita,Multiple Linear Regression in R: Tutorial With Examples,https://www.datacamp.com/tutorial/multiple-linear-regression-r-tutorial,R,blog,2022-12-06
DataCamp Team,Joining DataFrames in pandas Tutorial,https://www.datacamp.com/tutorial/joining-dataframes-pandas,Python,blog,2022-12-05
Joleen Bothma,A Beginner's Guide to Predictive Analytics,https://www.datacamp.com/blog/predictive-analytics-guide,Data Analysis,blog,2022-12-02
Nathaniel Taylor-Leach,Q3 2022 DataCamp Classrooms Roundup,https://www.datacamp.com/blog/q3-2022-data-camp-classrooms-roundup,DataCamp Classrooms,blog,2022-12-02
Joleen Bothma,Working with Geospatial Data: A Guide to Analysis in Power BI,https://www.datacamp.com/tutorial/working-with-geospatial-data,Power BI,blog,2022-11-25
Nathaniel Taylor-Leach,DataCamp Donates Digest Q3 2022,https://www.datacamp.com/blog/data-camp-donates-digest-q3-2022,DataCamp Donates,blog,2022-11-25
Kurtis Pykes,Sports Analytics: How Different Sports Use Data Analytics,https://www.datacamp.com/blog/sports-analytics-how-different-sports-use-data-analysis,Data Analysis,blog,2022-11-24
Moez Ali,Understanding Text Classification in Python,https://www.datacamp.com/tutorial/text-classification-python,Artificial Intelligence,blog,2022-11-23
Richie Cotton,How Data Science is Changing Soccer,https://www.datacamp.com/blog/how-data-science-is-changing-soccer,Data Science,blog,2022-11-21
Aimee Gott,Acing the DataCamp Certification Practical Exam,https://www.datacamp.com/blog/Acing-the-DataCamp-Certification-Practical,Certification,blog,2022-11-21
Elena Kosourova,What is Data Maturity and Why Does it Matter?,https://www.datacamp.com/blog/what-is-data-maturity-why-it-matters,Data Literacy,blog,2022-11-18
Kurtis Pykes,How to Write a Bash Script: A Simple Bash Scripting Tutorial,https://www.datacamp.com/tutorial/how-to-write-bash-script-tutorial,Data Analysis,blog,2022-11-18
Arne Warnke,Predicting FIFA World Cup Qatar 2022 Winners,https://www.datacamp.com/blog/predicting-soccer-world-cup-winners,R,blog,2022-11-18
Elena Kosourova,How to Make a Gantt Chart in Python with Matplotlib,https://www.datacamp.com/tutorial/how-to-make-gantt-chart-in-python-matplotlib,Data Visualization,blog,2022-11-16
Joleen Bothma,How to Create a Dashboard in Excel in 3 Easy Steps,https://www.datacamp.com/tutorial/create-excel-dashboards-tutorial,Spreadsheets,blog,2022-11-11
Chloe Lubin,Creating Stories in Tableau,https://www.datacamp.com/tutorial/creating-stories-tableau,Tableau,blog,2022-11-10
Matt Crabtree,Get a Free Week of Access and Join the XP Challenge,https://www.datacamp.com/blog/free-week-xp-challenge,Product News,blog,2022-11-07
Kurtis Pykes,Python Iterators and Generators Tutorial,https://www.datacamp.com/tutorial/python-iterators-generators-tutorial,Python,blog,2022-11-04
Joleen Bothma,An Introduction to Machine Learning with Julia,https://www.datacamp.com/blog/introduction-machine-learning-julia,Julia,blog,2022-11-03
Matt Crabtree,What is Julia Used For? 10 Applications of Julia Programming,https://www.datacamp.com/blog/what-is-julia-used-for,Julia,blog,2022-11-02
Javier Canales Luna,Progressing from MATLAB to Julia ,https://www.datacamp.com/blog/progressing-from-matlab-to-julia,Julia,blog,2022-10-31
Bekhruz Tuychiev,Julia Programming Tutorial For Beginners,https://www.datacamp.com/tutorial/julia-programming-tutorial-for-beginners,Julia,blog,2022-10-30
Justin Saddlemyer,How we switched to DataLab for our internal analytics,https://www.datacamp.com/blog/how-we-switched-to-workspace-for-our-internal-analytics,DataLab,blog,2022-10-27
Abid Ali Awan,An Introduction to Q-Learning: A Tutorial For Beginners,https://www.datacamp.com/tutorial/introduction-q-learning-beginner-tutorial,Machine Learning,blog,2022-10-27
Martijn Theuwissen,Introducing the DataCamp Unlimited Plan,https://www.datacamp.com/blog/introducing-datacamp-unlimited-plan,Product News,blog,2022-10-24
Kurtis Pykes,30 Cool Python Tricks For Better Code With Examples,https://www.datacamp.com/tutorial/python-tips-examples,Python,blog,2022-10-20
Moez Ali,Streamline Your Machine Learning Workflow with MLFlow,https://www.datacamp.com/tutorial/mlflow-streamline-machine-learning-workflow,Machine Learning,blog,2022-10-17
Elena Kosourova,A Guide to R Regular Expressions,https://www.datacamp.com/tutorial/regex-r-regular-expressions-guide,R,blog,2022-10-14
Nathaniel Taylor-Leach,How One Teacher Revolutionized Data Education in the Czech Republic,https://www.datacamp.com/blog/how-one-teacher-revolutionized-data-education-in-the-czech-republic,DataCamp Classrooms,blog,2022-10-14
Travis Tang,FORMAT() SQL FUNCTION,https://www.datacamp.com/tutorial/format-sql-function,SQL,blog,2022-10-12
Travis Tang,INSERT INTO SQL FUNCTION,https://www.datacamp.com/tutorial/insert-into-sql-function,SQL,blog,2022-10-12
Abid Ali Awan,An Introduction to Papers With Code,https://www.datacamp.com/blog/introduction-papers-with-code,Machine Learning,blog,2022-10-07
Joleen Bothma,What Does a Data Engineer Do?,https://www.datacamp.com/blog/what-does-data-engineer-do,Data Engineering,blog,2022-10-05
Abid Ali Awan,The Machine Learning Life Cycle Explained,https://www.datacamp.com/blog/machine-learning-lifecycle-explained,Machine Learning,blog,2022-10-03
Natassha Selvaraj,5 Ways to Use Data Science in Marketing,https://www.datacamp.com/blog/5-ways-use-data-science-marketing,Data Science,blog,2022-09-30
Joleen Bothma,What is Business Analytics? Everything You Need to Know,https://www.datacamp.com/blog/what-is-business-analytics,Data Analysis,blog,2022-09-30
Kurtis Pykes,10 Signs of Bad Data: How to Spot Poor Quality Data,https://www.datacamp.com/blog/10-signs-bad-data-quality,Data Literacy,blog,2022-09-29
DataCamp Team,[Infographic] 5 Best Practices for Building a Data Academy,https://www.datacamp.com/blog/infographic-5-best-practices-for-building-a-data-academy,Data Literacy,blog,2022-09-28
Moez Ali,FastAPI Tutorial: An Introduction to Using FastAPI,https://www.datacamp.com/tutorial/introduction-fastapi-tutorial,Python,blog,2022-09-26
DataCamp Team,[Infographic] Dashboard Design Checklist,https://www.datacamp.com/blog/infographic-dashboard-design-checklist,Data Literacy,blog,2022-09-22
Aimee Gott,Introducing Our New DataCamp Certification Advisory Panel,https://www.datacamp.com/blog/introducing-our-first-certification-advisory-panel,Certification,blog,2022-09-19
Javier Canales Luna,What Does a Data Analyst Do?,https://www.datacamp.com/blog/what-does-data-analyst-do,Data Literacy,blog,2022-09-16
Natassha Selvaraj,8 Machine Learning Models Explained in 20 Minutes,https://www.datacamp.com/blog/machine-learning-models-explained,Machine Learning,blog,2022-09-16
Judy Howarth,DataCamp Donates fights climate change: CDP's journey from R to Python,https://www.datacamp.com/blog/cdp-r-to-python,DataCamp Donates,blog,2022-09-15
Kurtis Pykes,The Importance of Data: 5 Top Reasons,https://www.datacamp.com/blog/importance-of-data-5-top-reasons,Data Literacy,blog,2022-09-15
DataCamp Team,A Beginner's Guide to The Machine Learning Workflow,https://www.datacamp.com/blog/a-beginner-s-guide-to-the-machine-learning-workflow,Machine Learning,blog,2022-09-09
Rayan Elatmani,DataCampers Volunteer Summer 2022,https://www.datacamp.com/blog/datacampers-volunteer-summer2022,Life at DataCamp,blog,2022-09-08
Richie Cotton,Data Demystified: Data Visualizations that Capture Distributions,https://www.datacamp.com/blog/data-demystified-data-visualizations-that-capture-distributions,Data Literacy,blog,2022-09-02
Richie Cotton,Data Demystified: Avoiding the AI Hype Trap,https://www.datacamp.com/blog/data-demystified-avoiding-the-ai-hype-trap,Data Literacy,blog,2022-09-01
Richie Cotton,Data Demystified: Data Visualizations that Capture Relationships,https://www.datacamp.com/blog/data-demystified-data-visualizations-that-capture-relationships,Data Literacy,blog,2022-09-01
Richie Cotton,"Data Demystified: The Difference Between Data Science, Machine Learning, Deep Learning, and Artificial Intelligence",https://www.datacamp.com/blog/data-demystified-the-difference-between-data-science-machine-learning-deep-learning-and-artificial-intelligence,Data Literacy,blog,2022-09-01
Richie Cotton,Data Demystified: The Four Types of Analytics,https://www.datacamp.com/blog/data-demystified-the-four-types-of-analytics,Data Literacy,blog,2022-09-01
Richie Cotton,Data Demystified: What is A/B Testing?,https://www.datacamp.com/blog/data-demystified-what-is-a-b-testing,Data Literacy,blog,2022-09-01
Richie Cotton,Data Demystified: Quantitative vs. Qualitative Data,https://www.datacamp.com/blog/data-demystified-quantitative-vs-qualitative-data,Data Literacy,blog,2022-09-01
Richie Cotton,Data Demystified: An Overview of Descriptive Statistics,https://www.datacamp.com/blog/data-demystified-an-overview-of-descriptive-statistics,Data Literacy,blog,2022-09-01
Richie Cotton,Data Demystified: What Exactly is Data?,https://www.datacamp.com/blog/data-demystified-what-exactly-is-data,Data Literacy,blog,2022-09-01
Richie Cotton,Data Demystified: The Different Types of AI Bias,https://www.datacamp.com/blog/data-demystified-the-different-types-of-ai-bias,Data Literacy,blog,2022-09-01
Richie Cotton,Data Demystified: Data Visualizations that Capture Trends,https://www.datacamp.com/blog/data-demystified-data-visualizations-that-capture-trends,Data Literacy,blog,2022-09-01
Adel Nehme,Announcing Data Literacy Month,https://www.datacamp.com/blog/announcing-data-literacy-month,Data Literacy,blog,2022-09-01
Meredith Esquivel,How Technical Recruiters Can Stay Competitive in Changing Economic Times,https://www.datacamp.com/blog/technical-recruiters-stay-competitive,Data Science,blog,2022-08-31
Abid Ali Awan,21 Essential Python Tools,https://www.datacamp.com/tutorial/21-essential-python-tools,Python,blog,2022-08-24
Javier Canales Luna,Python 2 vs 3: Everything You Need to Know,https://www.datacamp.com/blog/python-2-vs-3-everything-you-need-to-know,Python,blog,2022-08-23
Moez Ali,Supervised Machine Learning,https://www.datacamp.com/blog/supervised-machine-learning,Machine Learning,blog,2022-08-22
Seve Perez,How Teachers Stay Organized with DataCamp Classrooms: Teams and Assignments ,https://www.datacamp.com/blog/classrooms-teams-assignments,DataCamp Classrooms,blog,2022-08-21
DataCamp Team,DataCamp Recruit: A better way to hire data professionals,https://www.datacamp.com/blog/recruit-a-better-way-to-hire-data-professionals,Product News,blog,2022-08-19
Yinghui Chen,Why I Chose DataCamp Certification,https://www.datacamp.com/blog/why-i-chose-data-camp-certification,Certification,blog,2022-08-19
Zoumana Keita,How to Create a Power BI Heatmap,https://www.datacamp.com/tutorial/how-to-create-a-power-bi-heatmap,Power BI,blog,2022-08-16
DataCamp Team,Join the XP Learner Challenge and Win $500,https://www.datacamp.com/blog/xp-learner-challenge,Product News,blog,2022-08-15
DataCamp Team,Data Champions: The Secret Ingredient to Upskilling in Data-Driven Organizations,https://www.datacamp.com/blog/data-champions-the-secret-ingredient-to-upskilling-in-data-driven-organizations,Data Science,blog,2022-08-15
Rayan Elatmani,DataCamp Classrooms Lands in Australian High Schools,https://www.datacamp.com/blog/datacamp-classrooms-australia,DataCamp Classrooms,blog,2022-08-12
Kurtis Pykes,Introducing Python Magic Methods,https://www.datacamp.com/tutorial/introducing-python-magic-methods,Python,blog,2022-08-12
DataCamp Team,Radar Recap — Data Science Certification: Is It Worth It?,https://www.datacamp.com/blog/radar-recap-data-science-certification-worth-it,Certification,blog,2022-08-10
Zoumana Keita,An Introduction to Using Transformers and Hugging Face,https://www.datacamp.com/tutorial/an-introduction-to-using-transformers-and-hugging-face,Python,blog,2022-08-10
Abid Ali Awan,Creating Synthetic Data with Python Faker Tutorial,https://www.datacamp.com/tutorial/creating-synthetic-data-with-python-faker-tutorial,Python,blog,2022-08-10
Moez Ali,Clustering in Machine Learning: 5 Essential Clustering Algorithms,https://www.datacamp.com/blog/clustering-in-machine-learning-5-essential-clustering-algorithms,Machine Learning,blog,2022-08-09
Isabella Leslie Miller,Power BI vs Tableau Infographic,https://www.datacamp.com/blog/tableau-vs-power-bi-infographic,Data Visualization,blog,2022-08-05
Adel Nehme,Blog Recap — Hiring & Retaining Data Talents in 2022,https://www.datacamp.com/blog/recap-radar-hiring-retaining-talent-2022,Career Services,blog,2022-08-05
DataCamp Team,How to Write Business Analyst Job Descriptions,https://www.datacamp.com/blog/how-to-write-business-analyst-job-descriptions,For Business,blog,2022-08-04
Vicky Kennedy,Introducing New Associate Certifications,https://www.datacamp.com/blog/introducing-new-associate-certifications,Certification,blog,2022-08-02
Seve Perez,DataCamp Donates Q2 2022 Digest,https://www.datacamp.com/blog/datacamp-donates-q2-2022-digest,DataCamp Donates,blog,2022-08-02
Bekhruz Tuychiev,SQL Commands Glossary—An Overview of 25 Most Popular SQL Commands,https://www.datacamp.com/tutorial/sql-commands-glossaryan-overview-of-25-most-popular-sql-commands,SQL,blog,2022-07-29
Sejal Jaiswal,SQL Query Examples and Tutorial,https://www.datacamp.com/tutorial/sql-query-examples-and-tutorial,SQL,blog,2022-07-28
Zoumana Keita,Tableau Data Blending Tutorial,https://www.datacamp.com/tutorial/tableau-data-blending-tutorial,Tableau,blog,2022-07-28
Adel Nehme,Introducing the Data Maturity Webinar Series,https://www.datacamp.com/blog/introducing-the-data-maturity-webinar-series,Data Literacy,blog,2022-07-27
DataCamp Team,Radar Recap: Acing the Data Science Interview with Jay Feng,https://www.datacamp.com/blog/datacamp-radar-recap-acing-the-data-science-interview-with-jay-feng,Webinars,blog,2022-07-22
Rayan Elatmani,"Empowering 12,000 young Africans with a life-changing DataCamp scholarship",https://www.datacamp.com/blog/empowering-more-than-12000-young-african-with-a-data-science-scholarship,DataCamp Donates,blog,2022-07-22
DataCamp Team,Radar Recap: Acing the Data Science Resume with Jen Bricker,https://www.datacamp.com/blog/radar-recap-acing-the-data-science-resume-with-jen-bricker,Webinars,blog,2022-07-21
Abid Ali Awan,A Comprehensive Introduction to Graph Neural Networks (GNNs),https://www.datacamp.com/tutorial/comprehensive-introduction-graph-neural-networks-gnns-tutorial,Python,blog,2022-07-21
DataCamp Team,5 Python Challenges to Develop Your Skills,https://www.datacamp.com/blog/5-python-challenges,Python,blog,2022-07-18
DataCamp Team,5 SQL Challenges to Practice Your Skills,https://www.datacamp.com/blog/5-sql-challenges-to-practice-your-skills,SQL,blog,2022-07-18
DataCamp Team,What can you do with Power BI?,https://www.datacamp.com/blog/what-can-you-do-with-power-bi,Power BI,blog,2022-07-18
DataCamp Team,Get a Free Week of Access to DataCamp,https://www.datacamp.com/blog/free-week-access,Product News,blog,2022-07-18
DataCamp Team,What Can You Do With Python? ,https://www.datacamp.com/blog/what-can-you-do-with-python-5-ideas-for-experts,Python,blog,2022-07-18
DataCamp Team,What can you do with SQL?,https://www.datacamp.com/blog/what-can-you-do-with-sql,SQL,blog,2022-07-18
DataCamp Team,What can you do with R?,https://www.datacamp.com/blog/what-can-you-do-with-r,R,blog,2022-07-18
DataCamp Team,What can you do with Tableau?,https://www.datacamp.com/blog/what-can-you-do-with-tableau,Tableau,blog,2022-07-18
DataCamp Team,5 R Challenges to Develop Your Skills,https://www.datacamp.com/blog/5-r-challenges,R,blog,2022-07-18
Kurtis Pykes,How to Use Pytest for Unit Testing,https://www.datacamp.com/tutorial/pytest-tutorial-a-hands-on-guide-to-unit-testing,Python,blog,2022-07-15
Anuj Syal,Essential Takeaways From Stanford’s AI Index 2022 Report,https://www.datacamp.com/blog/essential-takeaways-from-stanfords-ai-index-2022-report,Artificial Intelligence,blog,2022-07-14
Eugenia Anello,Should Business Intelligence Analysts Learn to Code?,https://www.datacamp.com/blog/should-bi-analysts-learn-to-code,Data Analysis,blog,2022-07-14
Sejal Jaiswal,Is SQL a Programming Language? ,https://www.datacamp.com/blog/is-sql-a-programming-language,SQL,blog,2022-07-12
Abid Ali Awan,Deploying Python Functions and Prophet Forecasting Model in Tableau with TabPy,https://www.datacamp.com/tutorial/tabpy-tutorial-deploying-python-functions-and-prophet-forecasting-model,Python,blog,2022-07-11
Moez Ali,Building and Deploying Machine Learning Pipelines,https://www.datacamp.com/tutorial/kubeflow-tutorial-building-and-deploying-machine-learning-pipelines,Machine Learning,blog,2022-07-11
DataCamp Team,[Infographic] The Anatomy of a Data Team — Different Data Roles,https://www.datacamp.com/blog/infographic-the-anatomy-of-a-data-team-different-data-roles,Data Science,blog,2022-07-07
DataCamp Team,[Infographic] Data & Machine Learning Tools Landscape ,https://www.datacamp.com/blog/infographic-data-and-machine-learning-tools-landscape,Data Science,blog,2022-07-07
Adel Nehme,"The Past, Present, And Future of The Data Science Notebook",https://www.datacamp.com/blog/the-past-present-and-future-of-the-data-science-notebook,Data Science,blog,2022-07-07
Bekhruz Tuychiev,Top Python Packages For R Users — Become a Bilingual Data Scientist,https://www.datacamp.com/blog/top-python-packages-for-r-users-become-a-bilingual-data-scientist,Python,blog,2022-07-07
Kurtis Pykes,PyTorch Tutorial: Building a Simple Neural Network From Scratch,https://www.datacamp.com/tutorial/pytorch-tutorial-building-a-simple-neural-network-from-scratch,Python,blog,2022-07-06
Abid Ali Awan,K Means Clusters in Tableau with TabPy Tutorial,https://www.datacamp.com/tutorial/getting-started-with-tabpy,Tableau,blog,2022-07-05
Abid Ali Awan,TabyPy Tutorial: Getting Started With TabPy - Part 1,https://www.datacamp.com/blog/getting-started-with-tabpy-part-1,Python,blog,2022-07-05
Eugenia Anello,How to Negotiate Your Salary for a Data Job,https://www.datacamp.com/blog/how-to-negotiate-your-salary-for-a-data-job,Career Services,blog,2022-07-01
Bekhruz Tuychiev,What's New in Python 3.11 And Should You Even Bother With It?,https://www.datacamp.com/blog/whats-new-in-python-311-and-should-you-even-bother-with-it,Python,blog,2022-06-30
DataCamp Team,Radar Recap: A Day of Data Career Insights,https://www.datacamp.com/blog/radar-recap-a-day-of-data-career-insights,Webinars,blog,2022-06-30
Adel Nehme,What Is An Analytics Engineer? Everything You Need to Know,https://www.datacamp.com/blog/what-is-an-analytics-engineer-everything-you-need-to-know,Career Services,blog,2022-06-30
Summer Worsley,The 9 Most In-Demand Skills in the Data Industry,https://www.datacamp.com/blog/the-9-most-in-demand-skills-in-the-data-industry,Data Literacy,blog,2022-06-29
Zoumana Keita,NoSQL Databases: What Every Data Scientist Needs to Know,https://www.datacamp.com/blog/nosql-databases-what-every-data-scientist-needs-to-know,Data Science,blog,2022-06-24
Adel Nehme,How Smooth Are Your Data Team's Operations? Discover Your Organization's MLOps Maturity Level,https://www.datacamp.com/blog/how-smooth-are-your-data-teams-operations-discover-your-organizations-mlops-maturity-level,Machine Learning,blog,2022-06-17
Women in Data Science Costa Rica,DataCamp Donates is helping grow a new community of young women data scientists in Costa Rica,https://www.datacamp.com/blog/how-datacamp-donates-is-helping-young-women-in-costa-rica-engage-in-data-science,DataCamp Donates,blog,2022-06-17
Raven Todd DaSilva,How to Research the Company for Your Next Data Science Interview,https://www.datacamp.com/blog/how-to-research-the-company-for-your-next-data-science-interview,Certification,blog,2022-06-14
Abid Ali Awan,Visualizing Data with Python and Tableau Tutorial,https://www.datacamp.com/tutorial/visualizing-data-with-python-and-tableau-tutorial,Tableau,blog,2022-06-13
Alex Blackman,Your Top Resources Roundup: June 2022 💡,https://www.datacamp.com/blog/your-top-resources-roundup-june-2022,Product News,blog,2022-06-10
DataCamp Team,[Infographic] Data Cleaning Checklist,https://www.datacamp.com/blog/infographic-data-cleaning-checklist,Data Science,blog,2022-06-10
Vicky Kennedy,Certificates or Certification: Which should you choose?,https://www.datacamp.com/blog/certificates-or-certification-which-should-you-choose,Certification,blog,2022-06-10
Filip Schouwenaars,Notebooks for R Users,https://www.datacamp.com/blog/notebooks-for-r-users,DataLab,blog,2022-06-09
DataCamp Team,"DataCamp Radar, Helping you navigate the future of data careers",https://www.datacamp.com/blog/datacamp-radar-helping-you-navigate-the-future-of-data-careers-june-23rd-2022-900am-to-315pm-est,Webinars,blog,2022-06-08
Abid Ali Awan,How to Concatenate in Tableau Tutorial,https://www.datacamp.com/tutorial/how-to-concatenate-in-tableau-tutorial,Tableau,blog,2022-06-06
Joleen Bothma,Running Python Scripts in Power BI Tutorial,https://www.datacamp.com/tutorial/running-python-scripts-in-power-bi-tutorial,Power BI,blog,2022-06-02
Kurtis Pykes,Lessons from the Zen of Python ,https://www.datacamp.com/blog/lessons-from-the-zen-of-python,Python,blog,2022-05-31
Raven Todd DaSilva,Introducing our Exclusive Community for DataCamp Certified Learners,https://www.datacamp.com/blog/introducing-our-exclusive-community-for-datacamp-certified-learners,Product News,blog,2022-05-31
Moez Ali,How to Become a Data Architect ,https://www.datacamp.com/blog/how-to-become-a-data-architect,Data Science,blog,2022-05-30
Alex Blackman,Your  Top Resources Roundup: May 2022 💡,https://www.datacamp.com/blog/your-top-resources-roundup-may-2022,Product News,blog,2022-05-27
DataCamp Team,DataCamp Jobs and Recruit:  Simplifying finding the best jobs and candidates in data.,https://www.datacamp.com/blog/datacamp-jobs-and-recruit,For Business,blog,2022-05-27
Adel Nehme,Introducing the DataFramed Careers Series,https://www.datacamp.com/blog/introducing-the-dataframed-careers-series,Data Science,blog,2022-05-27
Nathaniel Taylor-Leach,DataCamp Donates Digest Q1 2022,https://www.datacamp.com/blog/datacamp-donates-digest-q1-2022,DataCamp Donates,blog,2022-05-26
Bekhruz Tuychiev,10 Python Packages to Add to Your Data Science Stack in 2022,https://www.datacamp.com/blog/10-python-packages-to-add-to-your-data-science-stack-in-2022,Python,blog,2022-05-25
