writer,title,url,topic,type,date
Abid Ali Awan,Run LLMs Locally: 7 Simple Methods,https://www.datacamp.com/tutorial/run-llms-locally-tutorial,Artificial Intelligence,blog,2024-05-07
Amberle McKee,Everything You Need to Know About Python's Maximum Integer Value,https://www.datacamp.com/tutorial/everything-you-need-to-know-about-pythons-maximum-integer-value,Python,blog,2024-05-06
Abid Ali Awan,7 Exciting AI Projects for All Levels in 2025,https://www.datacamp.com/blog/7-ai-projects-for-all-levels,Artificial Intelligence,blog,2024-05-05
Matt Crabtree,10 of The Best ChatGPT Plugins to Get The Most From AI in 2024,https://www.datacamp.com/blog/best-chat-gpt-plugins,Artificial Intelligence,blog,2024-05-03
Jake Roach,Building an ETL Pipeline with Airflow,https://www.datacamp.com/tutorial/building-an-etl-pipeline-with-airflow,Data Engineering,blog,2024-05-03
Nahla Davies,7 Artificial Intelligence (AI) Jobs You Can Pursue in 2025,https://www.datacamp.com/blog/jobs-in-ai-to-pursue,Artificial Intelligence,blog,2024-05-03
Bex Tuychiev,Snowflake Snowpark: A Comprehensive Introduction,https://www.datacamp.com/tutorial/snowpark-snoflake-introduction,Big Data,blog,2024-05-02
Bex Tuychiev,Reinforcement Learning: An Introduction With Python Examples,https://www.datacamp.com/tutorial/reinforcement-learning-python-introduction,Artificial Intelligence,blog,2024-05-02
Joleen Bothma,Power BI Matrix: A Comprehensive Guide,https://www.datacamp.com/tutorial/power-bi-matrix-a-comprehensive-guide,Power BI,blog,2024-05-02
Arunn Thevapalan,Monte Carlo Simulation in Excel: A Complete Guide,https://www.datacamp.com/tutorial/monte-carlo-simulation-in-excel,Spreadsheets,blog,2024-05-02
Tim Lu,Airflow vs Prefect: Deciding Which is Right For Your Data Workflow,https://www.datacamp.com/tutorial/airflow-vs-prefect-deciding-which-is-right-for-your-data-workflow,Data Engineering,blog,2024-05-02
Bex Tuychiev,Python Environment Variables: What You Need to Know,https://www.datacamp.com/tutorial/python-environment-variables,Python,blog,2024-04-29
Kevin Babitz,A Guide to Corporate Data Analytics Training,https://www.datacamp.com/blog/corporate-data-analytics-training,Data Analysis,blog,2024-04-29
Joleen Bothma,Power BI RELATED DAX Function: Introduction and Use Cases,https://www.datacamp.com/tutorial/power-bi-related-dax-function,Business Intelligence,blog,2024-04-28
Joleen Bothma,A Comprehensive Guide to DAX LOOKUPVALUE,https://www.datacamp.com/tutorial/guide-to-dax-lookupvalue,Power BI,blog,2024-04-26
Arunn Thevapalan,How to Calculate Confidence Intervals in Excel,https://www.datacamp.com/tutorial/how-to-calculate-confidence-intervals-in-excel,Spreadsheets,blog,2024-04-26
Gary Alway,An Introduction to Vector Databases For Machine Learning: A Hands-On Guide With Examples,https://www.datacamp.com/tutorial/introduction-to-vector-databases-for-machine-learning,Machine Learning,blog,2024-04-26
Jake Roach,The Top 21 Airflow Interview Questions and How to Answer Them,https://www.datacamp.com/blog/top-airflow-interview-questions,Data Engineering,blog,2024-04-26
Yesha Shastri,Attention Mechanism in LLMs: An Intuitive Explanation,https://www.datacamp.com/blog/attention-mechanism-in-llms-intuition,Artificial Intelligence,blog,2024-04-26
Bex Tuychiev,A Comprehensive Tutorial on Optical Character Recognition (OCR) in Python With Pytesseract,https://www.datacamp.com/tutorial/optical-character-recognition-ocr-in-python-with-pytesseract,Python,blog,2024-04-23
Filip Schouwenaars,Introducing DataLab,https://www.datacamp.com/blog/datacamp-is-launching-datalab,DataLab,blog,2024-04-22
Richie Cotton,What is Llama 3? The Experts' View on The Next Generation of Open Source LLMs ,https://www.datacamp.com/blog/meta-announces-llama-3-the-next-generation-of-open-source-llms,Artificial Intelligence,blog,2024-04-19
Adel Nehme,Navigating the World of MLOps Certifications,https://www.datacamp.com/blog/mlops-certifications,Machine Learning,blog,2024-04-18
Matt Crabtree,Navigating R Certifications in 2025: A Comprehensive Guide ,https://www.datacamp.com/blog/r-certification-guide,R,blog,2024-04-18
Alonso Quijano-Ruiz,"Breaking Barriers, Building Futures in Ecuador: Meet the New Dimensions Graduates",https://www.datacamp.com/blog/breaking-barriers-building-futures-in-ecuador-lide-new-dimensions-dc-donates,DataCamp Donates,blog,2024-04-12
DataCamp Team,You’re invited! Join us for Radar: AI Edition,https://www.datacamp.com/blog/youre-invited-join-us-for-radar-ai-edition,Artificial Intelligence,blog,2024-04-12
Adel Nehme,How to Convert a List to a String in Python,https://www.datacamp.com/tutorial/how-to-convert-a-list-to-a-string-in-python,Python,blog,2024-04-12
Eugenia Anello,How to Improve RAG Performance: 5 Key Techniques with Examples,https://www.datacamp.com/tutorial/how-to-improve-rag-performance-5-key-techniques-with-examples,Artificial Intelligence,blog,2024-04-12
Bex Tuychiev,Writing Custom Context Managers in Python,https://www.datacamp.com/tutorial/writing-custom-context-managers-in-python,Python,blog,2024-04-12
Moez Ali,Serving an LLM Application as an API Endpoint using FastAPI in Python,https://www.datacamp.com/tutorial/serving-an-llm-application-as-an-api-endpoint-using-fastapi-in-python,Artificial Intelligence,blog,2024-04-12
Elena Kosourova,How to Use the XLOOKUP Excel Function with Multiple Criteria,https://www.datacamp.com/tutorial/how-to-use-the-xlookup-excel-function-with-multiple-criteria,Spreadsheets,blog,2024-04-12
Zoumana Keita,Mastering AWS Step Functions: A Comprehensive Guide for Beginners ,https://www.datacamp.com/tutorial/mastering-aws-step-functions-a-comprehensive-guide,AWS,blog,2024-04-11
Adel Nehme,How to Check if a File Exists in Python,https://www.datacamp.com/tutorial/how-to-check-if-a-file-exists-in-python,Python,blog,2024-04-11
Iván Palomares Carrascosa,The Top 20 Deep Learning Interview Questions and Answers,https://www.datacamp.com/blog/the-top-20-deep-learning-interview-questions-and-answers,Deep Learning,blog,2024-04-11
Amberle McKee,Python Absolute Value: A Quick Tutorial,https://www.datacamp.com/tutorial/python-absolute-value-a-quick-tutorial,Python,blog,2024-04-11
DataCamp Team,Sorting Data in R,https://www.datacamp.com/tutorial/sorting-data-r,R,blog,2024-04-10
Amberle McKee,How to Exit Python: A Quick Tutorial,https://www.datacamp.com/tutorial/how-to-exit-python-a-quick-tutorial,Python,blog,2024-04-05
Abid Ali Awan,ML Workflow Orchestration With Prefect,https://www.datacamp.com/tutorial/ml-workflow-orchestration-with-prefect,Machine Learning,blog,2024-04-05
Austin Chia,LOD Expressions in Tableau: A Tutorial With Examples,https://www.datacamp.com/tutorial/lod-expressions-in-tableau-a-tutorial-with-examples,Tableau,blog,2024-04-05
Amberle McKee,Exploring Matplotlib Inline: A Quick Tutorial,https://www.datacamp.com/tutorial/exploring-matplotlib-inline-a-quick-tutorial,Python,blog,2024-04-05
Adel Nehme,How to Use the NumPy linspace() Function,https://www.datacamp.com/tutorial/how-to-use-the-numpy-linspace-function,Python,blog,2024-04-05
Austin Chia,Tableau Parameters: An Introductory Guide and How to Use Them,https://www.datacamp.com/tutorial/tableau-parameters-an-introductory-guide-and-how-to-use-them,Tableau,blog,2024-04-04
DataCamp Team,Scatterplot in R,https://www.datacamp.com/tutorial/scatterplot-in-r,R,blog,2024-03-31
Andrea Valenzuela,LLM Classification: How to Select the Best LLM for Your Application,https://www.datacamp.com/tutorial/llm-classification-how-to-select-the-best-llm-for-your-application,Artificial Intelligence,blog,2024-03-28
Josep Ferrer,A Comprehensive Guide to Working with the Mistral Large Model,https://www.datacamp.com/tutorial/guide-to-working-with-the-mistral-large-model,Artificial Intelligence,blog,2024-03-28
Srujana Maddula,An Introduction to Data Orchestration: Process and Benefits,https://www.datacamp.com/blog/introduction-to-data-orchestration-process-and-benefits,Data Engineering,blog,2024-03-28
Joleen Bothma,Complete Guide to Power BI Conditional Formatting,https://www.datacamp.com/tutorial/guide-to-power-bi-conditional-formatting,Power BI,blog,2024-03-27
Bex Tuychiev,PostgresML Tutorial: Doing Machine Learning With SQL,https://www.datacamp.com/tutorial/postgresml-tutorial-machine-learning-with-sql,Artificial Intelligence,blog,2024-03-27
Arunn Thevapalan,Python Private Methods Explained,https://www.datacamp.com/tutorial/python-private-methods-explained,Python,blog,2024-03-27
Joleen Bothma,Power BI Slicer Tutorial: A Comprehensive Guide to Enhancing Your Reports,https://www.datacamp.com/tutorial/power-bi-slicer-tutorial,Power BI,blog,2024-03-27
Elena Kosourova,How to Calculate Factorials in Excel: A Complete Guide,https://www.datacamp.com/tutorial/how-to-calculate-factorials-in-excel-complete-guide,Spreadsheets,blog,2024-03-26
Abid Ali Awan,Introduction to ChatGPT Next Web (NextChat),https://www.datacamp.com/tutorial/introduction-to-chatgpt-next-web-nextchat,Artificial Intelligence,blog,2024-03-26
Moez Ali,Estimating The Cost of GPT Using The tiktoken Library in Python,https://www.datacamp.com/tutorial/estimating-cost-of-gpt-using-tiktoken-library-python,Python,blog,2024-03-26
Laiba Siddiqui,GPTCache Tutorial: Enhancing Efficiency in LLM Applications,https://www.datacamp.com/tutorial/gptcache-tutorial-enhancing-efficiency-in-llm-applications,Artificial Intelligence,blog,2024-03-26
Elena Kosourova,How to Calculate Percentiles in Excel,https://www.datacamp.com/tutorial/how-to-calculate-percentiles-excel,Spreadsheets,blog,2024-03-21
Austin Chia,Tableau Prep Builder: A Comprehensive Guide to Data Preparation,https://www.datacamp.com/tutorial/tableau-prep-builder,Tableau,blog,2024-03-21
Moez Ali,A Beginner's Guide to Azure Machine Learning,https://www.datacamp.com/tutorial/azure-machine-learning-guide,Machine Learning,blog,2024-03-21
Nisha Arya Ahmed,"AWS Cloud Practitioner Salaries Explained: Skills, Demand, and Career Growth",https://www.datacamp.com/blog/aws-cloud-practitioner-salaries,Cloud,blog,2024-03-21
Abid Ali Awan,Fine Tuning Google Gemma: Enhancing LLMs with Customized Instructions,https://www.datacamp.com/tutorial/fine-tuning-google-gemma,Artificial Intelligence,blog,2024-03-21
Joleen Bothma,A Step-By-Step Guide to Visualizing KPIs in Power BI,https://www.datacamp.com/tutorial/power-bi-kpi,Power BI,blog,2024-03-20
Bex Tuychiev,Using Snowflake Time Travel: A Comprehensive Guide ,https://www.datacamp.com/tutorial/using-snowflake-time-travel-a-comprehensive-guide,Data Engineering,blog,2024-03-19
Zoumana Keita,Hugging Face Image Classification: A Comprehensive Guide With Examples,https://www.datacamp.com/tutorial/hugging-face-image-classification-guide,Artificial Intelligence,blog,2024-03-18
Zoumana Keita,Exploring Text-Embedding-3-Large: A Comprehensive Guide to the new OpenAI Embeddings,https://www.datacamp.com/tutorial/exploring-text-embedding-3-large-new-openai-embeddings,Artificial Intelligence,blog,2024-03-15
Bex Tuychiev,Python Data Classes: A Comprehensive Tutorial,https://www.datacamp.com/tutorial/python-data-classes,Python,blog,2024-03-15
Moez Ali,Fine-Tuning OpenAI's GPT-4: A Step-by-Step Guide,https://www.datacamp.com/tutorial/fine-tuning-openais-gpt-4-step-by-step-guide,Artificial Intelligence,blog,2024-03-14
Josep Ferrer,Hugging Face's Text Generation Inference Toolkit for LLMs - A Game Changer in AI ,https://www.datacamp.com/tutorial/hugging-faces-text-generation-inference-toolkit-for-llms,Artificial Intelligence,blog,2024-03-14
Kurtis Pykes,Apache Kafka for Beginners: A Comprehensive Guide,https://www.datacamp.com/tutorial/apache-kafka-for-beginners-a-comprehensive-guide,Data Engineering,blog,2024-03-13
Abid Ali Awan,Getting Started with Claude 3 and the Claude 3 API,https://www.datacamp.com/tutorial/getting-started-with-claude-3-and-the-claude-3-api,Artificial Intelligence,blog,2024-03-13
DataCamp Team,Top 5 Business Intelligence Courses to Take on DataCamp,https://www.datacamp.com/blog/top-5-business-intelligence-courses-to-take-on-datacamp,Business Intelligence,blog,2024-03-13
Matt Crabtree,What is Data Fluency? A Complete Guide With Resources ,https://www.datacamp.com/blog/what-is-data-fluency,Data Literacy,blog,2024-03-11
Rhys Phillips,How Aday Pivoted His Career Into Data and Landed a Job at Specsavers,https://www.datacamp.com/blog/how-aday-pivoted-his-career-into-data-at-specsavers,Learner Stories,blog,2024-03-11
Abid Ali Awan,14 Essential Data Engineering Tools to Use in 2025,https://www.datacamp.com/blog/top-data-engineer-tools,Data Engineering,blog,2024-03-08
Natassha Selvaraj,Linear Regression in Excel: A Comprehensive Guide For Beginners,https://www.datacamp.com/tutorial/linear-regression-in-excel,Spreadsheets,blog,2024-03-07
Arunn Thevapalan,How to Use HLOOKUP in Excel,https://www.datacamp.com/tutorial/how-to-use-hlookup-in-excel,Spreadsheets,blog,2024-03-07
Adel Nehme,Digital Upskilling Strategies for Transformative Success,https://www.datacamp.com/blog/digital-upskilling-strategies-for-transformative-success,Data Literacy,blog,2024-03-07
Kurtis Pykes,An Introduction to the Mamba LLM Architecture: A New Paradigm in Machine Learning,https://www.datacamp.com/tutorial/introduction-to-the-mamba-llm-architecture,Machine Learning,blog,2024-03-07
DataCamp Team,Operators in R,https://www.datacamp.com/tutorial/operators-in-r,R,blog,2024-03-03
Javier Canales Luna,What is Stable Code 3B?,https://www.datacamp.com/blog/what-is-stable-code-3b,Artificial Intelligence,blog,2024-03-01
Adel Nehme,How to Learn Deep Learning in 2025: A Complete Guide,https://www.datacamp.com/blog/how-to-learn-deep-learning,Deep Learning,blog,2024-02-29
DataCamp Team,Merging Data in R,https://www.datacamp.com/tutorial/merging-data-r,R,blog,2024-02-29
Javier Canales Luna,What is DeepMind AlphaGeometry?,https://www.datacamp.com/blog/what-is-deepmind-alphageometry,Artificial Intelligence,blog,2024-02-29
Matt Crabtree,Deep Learning (DL) vs Machine Learning (ML): A Comparative Guide,https://www.datacamp.com/tutorial/machine-deep-learning,Artificial Intelligence,blog,2024-02-29
Natassha Selvaraj,Python Linked Lists: Tutorial With Examples,https://www.datacamp.com/tutorial/python-linked-lists,Python,blog,2024-02-28
Moez Ali,Semantic Search with Pinecone and OpenAI,https://www.datacamp.com/tutorial/semantic-search-pinecone-openai,Artificial Intelligence,blog,2024-02-28
Zoumana Keita,Benchmarking High-Performance pandas Alternatives,https://www.datacamp.com/tutorial/benchmarking-high-performance-pandas-alternatives,Python,blog,2024-02-23
Kurtis Pykes,Building Intelligent Applications with Pinecone Canopy: A Beginner's Guide,https://www.datacamp.com/tutorial/pinecone-canopy-building-intelligent-applications,Artificial Intelligence,blog,2024-02-23
Javier Canales Luna,What is Multimodal AI?,https://www.datacamp.com/blog/what-is-multimodal-ai,Artificial Intelligence,blog,2024-02-22
Richmond Alake,OpenCV Tutorial: Unlock the Power of Visual Data Processing,https://www.datacamp.com/tutorial/opencv-tutorial,Machine Learning,blog,2024-02-22
Adel Nehme,How to Learn Machine Learning in 2025,https://www.datacamp.com/blog/how-to-learn-machine-learning,Machine Learning,blog,2024-02-22
Richie Cotton,Stability AI Announces Stable Diffusion 3: All We Know So Far,https://www.datacamp.com/blog/stability-ai-announces-stable-diffusion-3-all-we-know-so-far,Artificial Intelligence,blog,2024-02-22
Amina Edmunds,Test-Driven Development in Python: A Beginner's Guide,https://www.datacamp.com/tutorial/test-driven-development-in-python,Python,blog,2024-02-21
DataCamp Team,Axes and labels in R,https://www.datacamp.com/tutorial/axes-and-text,R,blog,2024-02-21
Bex Tuychiev,An Introduction to Debugging And Testing LLMs in LangSmith,https://www.datacamp.com/tutorial/introduction-to-langsmith,Artificial Intelligence,blog,2024-02-16
Abid Ali Awan,A Beginner's Guide to CI/CD for Machine Learning,https://www.datacamp.com/tutorial/ci-cd-for-machine-learning,Machine Learning,blog,2024-02-16
Adel Nehme,DataFramed Podcast Series: AI and the Modern Data Stack,https://www.datacamp.com/blog/dataframed-podcast-series-ai-and-the-modern-data-stack,Artificial Intelligence,blog,2024-02-15
Matt Crabtree,PostgreSQL Certification: Everything You Need to Know,https://www.datacamp.com/blog/postgre-sql-certification-everything-you-need-to-know,SQL,blog,2024-02-15
Adel Nehme,Python NaN: 4 Ways to Check for Missing Values in Python,https://www.datacamp.com/tutorial/python-nan-missing-values-in-python,Python,blog,2024-02-15
Matt Crabtree,The Complete Docker Certification (DCA) Guide for 2025,https://www.datacamp.com/blog/introduction-to-docker-certification,Docker,blog,2024-02-15
Bex Tuychiev,Salesforce XGen-7B: A Step-by-Step Tutorial on Using And Fine-Tuning XGen-7B,https://www.datacamp.com/tutorial/xgen-7b-step-by-step-tutorial,Artificial Intelligence,blog,2024-02-15
Adel Nehme,Mastering the Pandas .explode() Method: A Comprehensive Guide,https://www.datacamp.com/tutorial/pandas-explode,Python,blog,2024-02-14
Amberle McKee,How to Use the Python 'Not Equal' Operator,https://www.datacamp.com/tutorial/not-equal-python,Python,blog,2024-02-14
Amberle McKee,Finding the Size of a DataFrame in Python,https://www.datacamp.com/tutorial/python-dataframe-size,Python,blog,2024-02-14
Adel Nehme,A Guide to PyTorch Certifications & Certificates,https://www.datacamp.com/blog/pytorch-certifications-and-certificates,Certification,blog,2024-02-14
Moez Ali,How to Build LLM Applications with LangChain Tutorial,https://www.datacamp.com/tutorial/how-to-build-llm-applications-with-langchain,Artificial Intelligence,blog,2024-02-13
Matt Crabtree,What is Natural Language Processing (NLP)? A Comprehensive Guide for Beginners,https://www.datacamp.com/blog/what-is-natural-language-processing,Machine Learning,blog,2024-02-13
Vidhi Chugh,10 Top Machine Learning Algorithms & Their Use-Cases,https://www.datacamp.com/blog/top-machine-learning-use-cases-and-algorithms,Machine Learning,blog,2024-02-13
Abid Ali Awan,SQL CONTAINS: A Comprehensive Tutorial,https://www.datacamp.com/tutorial/sql-contains,SQL,blog,2024-02-09
Abid Ali Awan,SQL NOT IN Operator: A Comprehensive Guide for Beginners,https://www.datacamp.com/tutorial/sql-not-in-operator,SQL,blog,2024-02-09
Amberle McKee,How to Delete a File in Python,https://www.datacamp.com/tutorial/python-delete-file,Python,blog,2024-02-09
Kurtis Pykes,An Introduction to LMQL: The Bridge Between SQL and Large Language Models ,https://www.datacamp.com/tutorial/introduction-to-lmql,Artificial Intelligence,blog,2024-02-08
Laiba Siddiqui,Mastering SQL ROUND: Precision Handling in Data Analysis,https://www.datacamp.com/tutorial/mastering-sql-round,SQL,blog,2024-02-08
Bex Tuychiev,An End-to-End ML Model Monitoring Workflow with NannyML in Python,https://www.datacamp.com/tutorial/model-monitoring-with-nannyml-in-python,Python,blog,2024-02-08
Adel Nehme,Python List Size: 8 Different Methods for Finding the Length of a List in Python,https://www.datacamp.com/tutorial/python-list-size,Python,blog,2024-02-07
Andrea Valenzuela,LLMOps Essentials: A Practical Guide to Operationalizing Large Language Models,https://www.datacamp.com/blog/llmops-essentials-guide-to-operationalizing-large-language-models,Artificial Intelligence,blog,2024-02-02
DataCamp Team,How DataCamp Helps Drax Accelerate the Transition to Renewable Energy,https://www.datacamp.com/blog/how-datacamp-helps-drax-accelerate-the-transition-to-renewable-energy,Learner Stories,blog,2024-02-02
Adel Nehme,Python Append String: 6 Essential Concatenation Techniques,https://www.datacamp.com/tutorial/python-append-string,Python,blog,2024-02-02
Matt Crabtree,A Comprehensive Guide to SQL Certification on DataCamp,https://www.datacamp.com/blog/sql-certification,SQL,blog,2024-02-02
Adel Nehme,A Comprehensive Guide to Python Empty Lists,https://www.datacamp.com/tutorial/python-empty-list,Python,blog,2024-02-02
Abid Ali Awan,A Deep Dive into the Phi-2 Model,https://www.datacamp.com/tutorial/phi-2-model,Python,blog,2024-02-02
Zoumana Keita,Mastering Bayesian Optimization in Data Science,https://www.datacamp.com/tutorial/mastering-bayesian-optimization-in-data-science,Data Analysis,blog,2024-02-02
Abid Ali Awan,A Beginner's Guide to Python for Loops: Mastering for i in range,https://www.datacamp.com/tutorial/python-for-i-in-range,Python,blog,2024-01-31
Joleen Bothma,How to Use the SUMX Power BI Functions,https://www.datacamp.com/tutorial/how-to-use-the-sumx-power-bi-functions,Power BI,blog,2024-01-31
Moez Ali,How to Build a Chatbot Using the OpenAI API & Pinecone,https://www.datacamp.com/tutorial/how-to-build-chatbots-using-openai-api-and-pinecone,Artificial Intelligence,blog,2024-01-31
Jake Roach,Mastering Slowly Changing Dimensions (SCD),https://www.datacamp.com/tutorial/mastering-slowly-changing-dimensions-scd,Data Engineering,blog,2024-01-31
DataCamp Team,You’re invited! Join us for Radar: The Analytics Edition,https://www.datacamp.com/blog/join-us-for-radar-the-analytics-edition,Data Analysis,blog,2024-01-31
Abid Ali Awan,Emulating a Do-While Loop in Python: A Comprehensive Guide for Beginners,https://www.datacamp.com/tutorial/do-while-loop-python,Python,blog,2024-01-31
Arunn Thevapalan,PySide6 Tutorial: Building GUI Applications with Python,https://www.datacamp.com/tutorial/introduction-to-pyside6-for-building-gui-applications-with-python,Python,blog,2024-01-31
Arunn Thevapalan,A Comprehensive Guide to Databricks Lakehouse AI For Data Scientists,https://www.datacamp.com/tutorial/comprehensive-guide-to-databricks-lakehouse-ai,Artificial Intelligence,blog,2024-01-30
Kurtis Pykes,What is Google Gemini? Everything You Need To Know About Google’s ChatGPT Rival,https://www.datacamp.com/tutorial/what-is-google-gemini,Artificial Intelligence,blog,2024-01-30
Filip Schouwenaars,How to Send Microsoft Teams Messages with Python,https://www.datacamp.com/tutorial/how-to-send-microsoft-teams-messages-with-python,Python,blog,2024-01-30
DataCamp Team,Combining Plots,https://www.datacamp.com/tutorial/combining-plots,R,blog,2024-01-29
Nathaniel Taylor-Leach,Q4 2023 DataCamp Donates Digest,https://www.datacamp.com/blog/q4-2023-datacamp-donates-digest,DataCamp Donates,blog,2024-01-27
Matt Crabtree,Data Analyst vs. Data Scientist: A Comparative Guide For 2025,https://www.datacamp.com/blog/data-analyst-vs-data-scientist-a-comparative-guide,Data Science,blog,2024-01-26
Nisha Arya Ahmed,Understanding and Mitigating Bias in Large Language Models (LLMs),https://www.datacamp.com/blog/understanding-and-mitigating-bias-in-large-language-models-llms,Artificial Intelligence,blog,2024-01-25
Amberle McKee,Data Sets and Where to Find Them: Navigating the Landscape of Information,https://www.datacamp.com/blog/data-sets-and-where-to-find-them-navigating-the-landscape-of-information,Data Analysis,blog,2024-01-25
Nisha Arya Ahmed,Understanding and Mitigating Bias in Large Language Models (LLMs),https://www.datacamp.com/blog/understanding-and-mitigating-bias-in-large-language-models-llms,Artificial Intelligence,blog,2024-01-25
Zoumana Keita,SOLAR-10.7B Fine-Tuned Model Tutorial,https://www.datacamp.com/tutorial/solar-10-7b-fine-tuned-model-tutorial,Artificial Intelligence,blog,2024-01-25
Nisha Arya Ahmed,The 10 Best Custom GPTs on the GPT Store,https://www.datacamp.com/blog/best-custom-gpts-on-the-gpt-store,Artificial Intelligence,blog,2024-01-24
Abid Ali Awan,Introducing Google Gemini API: Discover the Power of the New Gemini AI Models,https://www.datacamp.com/tutorial/introducing-gemini-api,Artificial Intelligence,blog,2024-01-23
Austin Chia,MLOps Roadmap: A Complete MLOps Career Guide,https://www.datacamp.com/blog/mlops-roadmap,Machine Learning,blog,2024-01-19
Zoumana Keita,Fine-Tuning GPT-3 Using the OpenAI API and Python,https://www.datacamp.com/tutorial/fine-tuning-gpt-3-using-the-open-ai-api-and-python,Artificial Intelligence,blog,2024-01-19
Zoumana Keita,Exploring BLOOM: A Comprehensive Guide to the Multilingual Large Language Model,https://www.datacamp.com/blog/exploring-bloom-guide-to-multilingual-llm,Artificial Intelligence,blog,2024-01-19
Bex Tuychiev,Databricks Tutorial: 7 Must-know Concepts For Any Data Specialist,https://www.datacamp.com/tutorial/introduction-to-databricks,Data Analysis,blog,2024-01-16
Kurtis Pykes,Alteryx Tutorial: A Comprehensive Hands-On Guide for Data Analytics,https://www.datacamp.com/tutorial/alteryx-tutorial-guide-for-data-analytics,Data Analysis,blog,2024-01-16
Moez Ali,Mastering Low-Rank Adaptation (LoRA): Enhancing Large Language Models for Efficient Adaptation,https://www.datacamp.com/tutorial/mastering-low-rank-adaptation-lora-enhancing-large-language-models-for-efficient-adaptation,Artificial Intelligence,blog,2024-01-16
Matt Crabtree,What is Prompt Engineering? A Detailed Guide For 2025,https://www.datacamp.com/blog/what-is-prompt-engineering-the-future-of-ai-communication,Artificial Intelligence,blog,2024-01-12
Kurtis Pykes,Introduction to Unsupervised Learning,https://www.datacamp.com/blog/introduction-to-unsupervised-learning,Machine Learning,blog,2024-01-12
Filip Schouwenaars,How to Send Slack Messages with Python,https://www.datacamp.com/tutorial/how-to-send-slack-messages-with-python,Python,blog,2024-01-12
Moez Ali,Top 26 Python Libraries for Data Science in 2025,https://www.datacamp.com/blog/top-python-libraries-for-data-science,Python,blog,2024-01-12
Javier Canales Luna,The 23 Best Data Science Books to Read in 2025,https://www.datacamp.com/blog/the-22-best-data-science-books-to-read-in-2022,Data Science,blog,2024-01-12
Bex Tuychiev,dbt Tutorial: 7 Must-Know Concepts For Data Engineers,https://www.datacamp.com/tutorial/dbt-tutorial-must-know-concepts-for-data-engineers,Data Engineering,blog,2024-01-11
Austin Chia,How to Make a Seaborn Histogram: A Detailed Guide,https://www.datacamp.com/tutorial/how-to-make-a-seaborn-histogram,Python,blog,2024-01-11
Avinash Navlani,Building a Chatbot using Chatterbot in Python,https://www.datacamp.com/tutorial/building-a-chatbot-using-chatterbot,Python,blog,2024-01-10
