writer,title,url,topic,type,date
Dario Radečić,Add Users to Docker Group: A Guide for Data Professionals,https://www.datacamp.com/tutorial/add-users-to-docker-group,Docker,blog,2025-05-17
Dario Radečić,Docker Build Args: The Ultimate Guide for Data Professionals,https://www.datacamp.com/tutorial/docker-build-args,Docker,blog,2025-05-17
Aashi Dutt,OpenAI's Codex: A Guide With 3 Practical Examples,https://www.datacamp.com/tutorial/openai-codex,AI Agents,blog,2025-05-17
Elena Kosourova,R-Squared Explained: How Well Does Your Regression Model Fit?,https://www.datacamp.com/tutorial/r-squared,Data Analysis,blog,2025-05-14
Laiba Siddiqui,"Flash Fill Excel: Tips, Tricks, and Limitations to Know",https://www.datacamp.com/tutorial/flash-fill-excel,Excel,blog,2025-05-13
Vidhi Chugh,Understanding Propensity Scores: A Guide to Reducing Bias in Observational Studies,https://www.datacamp.com/tutorial/propensity-score,Data Analysis,blog,2025-05-13
Laiba Siddiqui,Bullet Points in Excel: 8 Easy Ways to Organize Your Lists,https://www.datacamp.com/tutorial/bullet-points-in-excel,Excel,blog,2025-05-13
Dario Radečić,Docker Buildx: How To Build Multi-Platform Container Images,https://www.datacamp.com/tutorial/docker-buildx,Docker,blog,2025-05-13
Laiba Siddiqui,How to Divide in Excel: A Beginner-Friendly Breakdown,https://www.datacamp.com/tutorial/how-to-divide-in-excel,Excel,blog,2025-05-13
Abid Ali Awan,Warp Terminal Tutorial: AI-Powered Features for Developers and Data Pros,https://www.datacamp.com/tutorial/warp-terminal-tutorial,AI Agents,blog,2025-05-12
Abid Ali Awan,Haystack AI Tutorial: Building Agentic Workflows,https://www.datacamp.com/tutorial/haystack-ai-tutorial,AI Agents,blog,2025-05-12
Javier Canales Luna,"Sensitivity Analysis in Excel Tutorial: Overview, Types, and Best Practices",https://www.datacamp.com/tutorial/sensitivity-analysis-in-excel,Excel,blog,2025-05-11
Matt Crabtree,Java Full-Stack Developer Roadmap: A 12-Month Learning Path,https://www.datacamp.com/blog/java-full-stack-developer-roadmap,Java,blog,2025-05-11
Srujana Maddula,What Is Data Partitioning? A Complete Guide for Beginners,https://www.datacamp.com/blog/what-is-data-partitioning,Data Engineering,blog,2025-05-10
Tom Farnschläder,"What Are Deepfakes? Examples, Applications, Ethical Challenges",https://www.datacamp.com/blog/deepfakes,Artificial Intelligence,blog,2025-05-09
Matt Crabtree,AI Developer Roadmap: A 12-Month Learning Path to Mastery,https://www.datacamp.com/blog/ai-developer-roadmap,Artificial Intelligence,blog,2025-05-09
Mark Pedigo,Progress Bars in Python: A Complete Guide with Examples,https://www.datacamp.com/tutorial/progress-bars-in-python,Python,blog,2025-05-09
Aashi Dutt,OpenAI's O3 API: Step-by-Step Tutorial With Examples,https://www.datacamp.com/tutorial/o3-api,Artificial Intelligence,blog,2025-05-09
Kevin Babitz,Top Data Science Conferences for 2025,https://www.datacamp.com/blog/top-data-science-conferences-for-2022,Data Science,blog,2025-05-08
Elena Kosourova,Top 10 Business Intelligence Conferences in 2025,https://www.datacamp.com/blog/top-business-intelligence-conferences,Power BI,blog,2025-05-08
Allan Ouko,Fill Handle Excel: How to Speed Up Data Entry,https://www.datacamp.com/tutorial/fill-handle-excel,Excel,blog,2025-05-08
Adejumo Ridwan Suleiman,Top Cloud Conferences in 2025,https://www.datacamp.com/blog/top-cloud-conferences,Cloud,blog,2025-05-08
Allan Ouko,Top 10 Data Engineering Conferences in 2025,https://www.datacamp.com/blog/top-data-engineering-conferences,Data Engineering,blog,2025-05-08
Adejumo Ridwan Suleiman,Top Learning and Development Conferences in 2025,https://www.datacamp.com/blog/learning-and-development-conferences,Career Services,blog,2025-05-08
Kevin Babitz,Top 10 Machine Learning Conferences for 2025,https://www.datacamp.com/blog/top-machine-learning-conferences,Machine Learning,blog,2025-05-08
Vikash Singh,AI Agent Frameworks: Building Smarter Systems with the Right Tools,https://www.datacamp.com/blog/ai-agent-frameworks,AI Agents,blog,2025-05-08
Laiba Siddiqui,How to Move Columns in Excel: Simple Techniques and Pro Tips,https://www.datacamp.com/tutorial/how-to-move-columns-in-excel,Excel,blog,2025-05-07
Amole Oluwaferanmi,Power BI License Types: Who Each Plan Is For,https://www.datacamp.com/blog/power-bi-license-types,Power BI,blog,2025-05-07
Aashi Dutt,Qwen-Agent: A Guide With Demo Project,https://www.datacamp.com/tutorial/qwen-agent,Artificial Intelligence,blog,2025-05-07
Javier Canales Luna,PostgreSQL vs MongoDB: Choosing the Right Database for Your Data Projects,https://www.datacamp.com/blog/postgresql-vs-mongodb,MongoDB,blog,2025-05-06
Aashi Dutt,Google's Agent2Agent Protocol (A2A): A Guide With Examples ,https://www.datacamp.com/blog/a2a-agent2agent,Artificial Intelligence,blog,2025-05-06
François Aubry,n8n: A Guide With Practical Examples,https://www.datacamp.com/tutorial/n8n-ai,AI Agents,blog,2025-05-06
Oluseye Jeremiah,"Git Branch: A Guide to Creating, Managing, and Merging Branches",https://www.datacamp.com/tutorial/git-branch,Git,blog,2025-05-06
Adejumo Ridwan Suleiman,Mastering COUNTIF() in Power BI: A DAX-Based Approach,https://www.datacamp.com/tutorial/power-bi-countif,Power BI,blog,2025-05-06
Allan Ouko,#SPILL! Error Excel: What It Means and How to Fix It,https://www.datacamp.com/tutorial/spill-error-excel,Excel,blog,2025-05-06
Vinod Chugani,Age Formula in Excel: Easy Methods for Age Calculation,https://www.datacamp.com/tutorial/age-formula-in-excel,Excel,blog,2025-05-05
Austin Chia,Lookup Functions in Excel: An Overview of 5 Functions,https://www.datacamp.com/tutorial/lookup-functions-excel,Excel,blog,2025-05-05
Iheb Gafsi,Benefits of Cloud Computing: Driving Growth and Innovation in Business,https://www.datacamp.com/blog/benefits-of-cloud-computing,Cloud,blog,2025-05-05
Vinod Chugani,"Types of AI Agents: Understanding Their Roles, Structures, and Applications",https://www.datacamp.com/blog/types-of-ai-agents,Artificial Intelligence,blog,2025-05-05
Jachimma Christian,Spell Check in Excel: Find and Fix Errors,https://www.datacamp.com/tutorial/spell-check-in-excel,Excel,blog,2025-05-04
Allan Ouko,Superscript in Excel: Format Text and Numbers Above the Line,https://www.datacamp.com/tutorial/superscript-in-excel,Excel,blog,2025-05-03
Kenny Ang,Helm Chart Tutorial: A Step-by-Step Guide with Examples,https://www.datacamp.com/tutorial/helm-chart,Kubernetes,blog,2025-05-03
Patrick Brus,OpenShift vs. Kubernetes: Key Differences Explained,https://www.datacamp.com/blog/openshift-vs-kubernetes,Kubernetes,blog,2025-05-03
François Aubry,GPT-Image-1 API: A Step-by-Step Guide With Examples,https://www.datacamp.com/tutorial/gpt-image-1,Artificial Intelligence,blog,2025-05-01
Tom Farnschläder,Grok 3 API: A Step-by-Step Guide With Examples,https://www.datacamp.com/tutorial/grok-3-api,Artificial Intelligence,blog,2025-05-01
Javier Canales Luna,Hyperlink in Excel: A Complete Guide to Creating and Managing Links,https://www.datacamp.com/tutorial/hyperlink-in-excel,Excel,blog,2025-04-30
Allan Ouko,Absolute Reference Excel: Stop Cell References from Moving,https://www.datacamp.com/tutorial/absolute-reference-excel,Excel,blog,2025-04-30
Josef Waples,"Time Series Decomposition: Understand Trends, Seasonality, and Noise",https://www.datacamp.com/tutorial/time-series-decomposition,Data Science,blog,2025-04-30
Matt Crabtree,Data Analyst Roadmap: A 12-Month Step-by-Step Learning Plan,https://www.datacamp.com/blog/data-analyst-roadmap,Data Analysis,blog,2025-04-30
Aashi Dutt,How to Set Up and Run Qwen 3 Locally With Ollama,https://www.datacamp.com/tutorial/qwen3-ollama,Artificial Intelligence,blog,2025-04-30
Javier Canales Luna,Unhide Columns in Excel: Easy Methods and Pro Tips,https://www.datacamp.com/tutorial/unhide-columns-in-excel,Excel,blog,2025-04-30
Abid Ali Awan,Fine-Tuning Qwen3: A Step-by-Step Guide,https://www.datacamp.com/tutorial/fine-tuning-qwen3,Artificial Intelligence,blog,2025-04-29
Alex Olteanu,"Qwen 3: Features, DeepSeek-R1 Comparison, Access, and More",https://www.datacamp.com/blog/qwen3,Artificial Intelligence,blog,2025-04-29
Ashlyn Brooks,"Virtualization in Cloud Computing: Concepts, Types, and Use Cases",https://www.datacamp.com/blog/virtualization-in-cloud-computing,Cloud,blog,2025-04-29
Benito Martin,"Python User Input: Handling, Validation, and Best Practices",https://www.datacamp.com/tutorial/python-user-input,Python,blog,2025-04-29
Allan Ouko,Excel Convert Text to Number: Easy Methods That Work,https://www.datacamp.com/tutorial/excel-convert-text-to-number,Excel,blog,2025-04-29
Dr Ana Rojo-Echeburúa,"What Is Vibe Coding? Definition, Tools, Pros, and Cons",https://www.datacamp.com/blog/vibe-coding,Artificial Intelligence,blog,2025-04-28
Derrick Mwiti,PySpark Joins: Optimize Big Data Join Performance,https://www.datacamp.com/tutorial/pyspark-joins,PySpark,blog,2025-04-28
Patrick Brus,"What Is a Data Lake? Definition, Architecture, and Use Cases",https://www.datacamp.com/blog/what-is-a-data-lake,Data Engineering,blog,2025-04-28
Austin Chia,Power BI Report Builder: A Guide For Beginners,https://www.datacamp.com/tutorial/power-bi-report-builder,Power BI,blog,2025-04-27
Austin Chia,Hierarchical Clustering: Concept Overview With Examples,https://www.datacamp.com/tutorial/hierarchical-clustering,Data Analysis,blog,2025-04-27
Dario Radečić,SSH Keys Explained: Guide to Fast and Secure Remote Access,https://www.datacamp.com/tutorial/ssh-keys,Data Engineering,blog,2025-04-27
Laiba Siddiqui,Remove Blank Rows in Excel: 4 Easy Methods,https://www.datacamp.com/tutorial/remove-blank-rows-in-excel,Excel,blog,2025-04-26
Allan Ouko,Excel ROUND(): The Complete Guide to Rounding in Excel,https://www.datacamp.com/tutorial/excel-round,Excel,blog,2025-04-25
Tim Lu,Building Data Pipelines in Snowflake: A Beginner-Friendly Guide,https://www.datacamp.com/tutorial/building-data-pipelines-in-snowflake,Snowflake,blog,2025-04-24
Aashi Dutt,O4-Mini API: Step-by-Step Tutorial With Demo Project,https://www.datacamp.com/tutorial/o4-mini-api,Artificial Intelligence,blog,2025-04-24
Marie Fayard,OpenAI's O3: A Guide With Five Practical Examples,https://www.datacamp.com/tutorial/o3-open-ai-examples,Artificial Intelligence,blog,2025-04-24
Marie Fayard,Atomicity in Databases: The Backbone of Reliable Transactions,https://www.datacamp.com/tutorial/atomicity,Data Engineering,blog,2025-04-24
Tim Lu,Snowflake Data Ingestion: A Comprehensive Guide,https://www.datacamp.com/tutorial/snowflake-data-ingestion,Snowflake,blog,2025-04-23
Marie Fayard,SQL Injection: How it Works and How to Prevent it,https://www.datacamp.com/tutorial/sql-injection,SQL,blog,2025-04-23
Don Kaluarachchi,Apache Airflow 3.0 Is Here: The Most Significant Release Yet,https://www.datacamp.com/blog/apache-airflow-3-0,Airflow,blog,2025-04-23
Bex Tuychiev,Top 13 ChatGPT Wrappers to Maximize Functionality and Efficiency,https://www.datacamp.com/blog/beyond-chatgpt-13-best-wrappers,Artificial Intelligence,blog,2025-04-22
Abid Ali Awan,What Is DALL-E?,https://www.datacamp.com/blog/what-is-dall-e,Artificial Intelligence,blog,2025-04-22
Abhishek Kasireddy,Scraping Reddit with Python and BeautifulSoup 4,https://www.datacamp.com/tutorial/scraping-reddit-python-scrapy,Python,blog,2025-04-22
Amberle McKee,Snscrape Tutorial: How to Scrape Social Media with Python,https://www.datacamp.com/tutorial/snscrape-tutorial-web-scraping,Data Science,blog,2025-04-22
Abid Ali Awan,OpenAI Codex CLI Tutorial,https://www.datacamp.com/tutorial/open-ai-codex-cli-tutorial,OpenAI,blog,2025-04-22
Aditya Sharma,How to Use Python to Scrape Amazon,https://www.datacamp.com/tutorial/amazon-web-scraping-using-beautifulsoup,Python,blog,2025-04-22
Sayak Paul,How to Install PostgreSQL on Windows and Mac OS X,https://www.datacamp.com/tutorial/installing-postgresql-windows-macosx,SQL,blog,2025-04-22
Sicelo Masango,Web Scraping using Python (and Beautiful Soup),https://www.datacamp.com/tutorial/web-scraping-using-python,Python,blog,2025-04-21
Vinod Chugani,Ethical Web Scraping: Principles and Practices,https://www.datacamp.com/blog/ethical-web-scraping,Python,blog,2025-04-21
Allan Ouko,Web Scraping Projects: Ideas for All Skill Levels,https://www.datacamp.com/blog/web-scraping-projects,Python,blog,2025-04-20
Arunn Thevapalan,Gaussian Elimination: A Method to Solve Systems of Equations,https://www.datacamp.com/tutorial/gaussian-elimination,Data Science,blog,2025-04-18
Alex Olteanu,"OpenAI's O4-Mini: Tests, Features, O3 Comparison, and More",https://www.datacamp.com/blog/o4-mini,Artificial Intelligence,blog,2025-04-17
Alex Olteanu,"OpenAI’s O3: Features, O1 Comparison, Benchmarks & More",https://www.datacamp.com/blog/o3-openai,Artificial Intelligence,blog,2025-04-17
Samuel Shaibu,Data Analyst Degree: Weighing Your Career Options,https://www.datacamp.com/blog/data-analyst-degree,Career Services,blog,2025-04-17
Abid Ali Awan,GPT-4.1 Guide With Demo Project: Keyword Code Search Application,https://www.datacamp.com/tutorial/gpt-4-1-guide-demo-project,OpenAI,blog,2025-04-17
Javier Canales Luna,Python Pie Chart: Build and Style with Pandas and Matplotlib,https://www.datacamp.com/tutorial/python-pie-chart,Python,blog,2025-04-17
Allan Ouko,SQL Server Index: Boosting Database Performance,https://www.datacamp.com/tutorial/sql-server-index,SQL,blog,2025-04-17
Arunn Thevapalan,Excel Compound Interest Formula: A Comprehensive Guide,https://www.datacamp.com/tutorial/compound-interest-formula-excel,Excel,blog,2025-04-17
Arun Nanda,Enhancing Large Language Models with Knowledge Graphs,https://www.datacamp.com/blog/knowledge-graphs-and-llms,Artificial Intelligence,blog,2025-04-16
Marie Fayard,Firebase Studio: An Honest Review With Examples,https://www.datacamp.com/tutorial/firebase-studio,Artificial Intelligence,blog,2025-04-16
Dr Ana Rojo-Echeburúa,Midjourney V7: A Guide With 8 Practical Examples,https://www.datacamp.com/tutorial/midjourney-v7,Artificial Intelligence,blog,2025-04-16
Don Kaluarachchi,"Cloud Service Models Explained: IaaS, PaaS, and SaaS",https://www.datacamp.com/blog/cloud-service-models,Cloud,blog,2025-04-16
Vinod Chugani,ChatGPT vs. Copilot: Choosing the Best AI Assistant for Your Needs,https://www.datacamp.com/blog/chatgpt-vs-copilot,Large Language Models,blog,2025-04-16
Vinod Chugani,Hamming Distance Explained: The Theory and Applications,https://www.datacamp.com/tutorial/hamming-distance,Data Science,blog,2025-04-16
Alex Olteanu,"GPT 4.1: Features, Access, GPT-4o Comparison, and More",https://www.datacamp.com/blog/gpt-4-1,Artificial Intelligence,blog,2025-04-15
Patrick Brus,"Git Tag Tutorial: How to Create, Manage and Use Tags",https://www.datacamp.com/tutorial/git-tag,Git,blog,2025-04-15
Rajesh Kumar,"Excel Macros Tutorial: Automate Formatting, Reporting, and Data Entry",https://www.datacamp.com/tutorial/excel-macros-tutorial,Excel,blog,2025-04-15
Derrick Mwiti,Apriori Algorithm Explained: A Step-by-Step Guide with Python Implementation,https://www.datacamp.com/tutorial/apriori-algorithm,Machine Learning,blog,2025-04-15
Tim Lu,Sharding vs Partitioning: Understanding Database Distribution,https://www.datacamp.com/blog/sharding-vs-partitioning,Data Engineering,blog,2025-04-15
Aashi Dutt,Google's Agent Development Kit (ADK): A Guide With Demo Project,https://www.datacamp.com/tutorial/agent-development-kit-adk,Artificial Intelligence,blog,2025-04-14
Dario Radečić,Docker Remove Image: How to Delete Unused and Dangling Images,https://www.datacamp.com/tutorial/docker-remove-image,Docker,blog,2025-04-14
Laiba Siddiqui,AWS Certifications for Data Engineers in 2025: A Complete Guide,https://www.datacamp.com/blog/aws-data-engineer-certifications,AWS,blog,2025-04-14
Austin Chia,How to Learn Power BI From Scratch in 2025,https://www.datacamp.com/blog/how-to-learn-power-bi,Power BI,blog,2025-04-14
Dario Radečić,Docker Remove Image: How to Delete Unused and Dangling Images,https://www.datacamp.com/tutorial/docker-remove-image,Docker,blog,2025-04-14
Abid Ali Awan,Llama 4 With RAG: A Guide With Demo Project,https://www.datacamp.com/tutorial/llama-4-rag,Artificial Intelligence,blog,2025-04-14
Dario Radečić,How to Delete a GitHub Repository: The Complete Guide,https://www.datacamp.com/tutorial/how-to-delete-a-github-repository,Git,blog,2025-04-12
Joleen Bothma,Power BI Developer Salaries in 2025: Unlock Your Earning Potential,https://www.datacamp.com/blog/power-bi-developer-salaries,Power BI,blog,2025-04-12
Elena Kosourova,SQL Developer Salaries: Benchmarks for 2025,https://www.datacamp.com/blog/sql-developer-salaries,SQL,blog,2025-04-12
Jose Jorge Rodriguez Salgado,How to Become a Data Scientist in 2025,https://www.datacamp.com/blog/how-to-become-a-data-scientist,Data Science,blog,2025-04-11
Arunn Thevapalan,Python String to DateTime: How to Convert Strings to DateTime Objects ,https://www.datacamp.com/tutorial/converting-strings-datetime-objects,Python,blog,2025-04-11
Javier Canales Luna,How to Become a Data Engineer in 2025: 5 Steps for Career Success,https://www.datacamp.com/blog/how-to-become-a-data-engineer,Data Engineering,blog,2025-04-11
Jess Ahmet,Working with PivotTables in Excel,https://www.datacamp.com/blog/working-with-pivot-tables-excel,Data Analysis,blog,2025-04-10
Josef Waples,The Demand Curve: How to Understand the Relationship Between Price and Sales,https://www.datacamp.com/tutorial/demand-curve,Data Analysis,blog,2025-04-10
Arjun Sarkar,Transformer Model Tutorial in PyTorch: From Theory to Code,https://www.datacamp.com/tutorial/building-a-transformer-with-py-torch,Artificial Intelligence,blog,2025-04-10
Matt Crabtree,A Complete Guide to Business Analyst Salaries in 2025,https://www.datacamp.com/blog/complete-guide-to-business-analyst-salaries,Career Services,blog,2025-04-10
Aashi Dutt,Llama 4 With vLLM: A Guide With Demo Project,https://www.datacamp.com/tutorial/llama-4-vllm,Artificial Intelligence,blog,2025-04-10
Vinod Chugani,Understanding the Pareto Distribution: A Comprehensive Guide,https://www.datacamp.com/tutorial/pareto-distribution,Data Science,blog,2025-04-10
Allan Ouko,Excel INDIRECT(): How to Build Dynamic References in Your Formulas,https://www.datacamp.com/tutorial/excel-indirect,Excel,blog,2025-04-10
Matt Crabtree,The Top AI Certifications for 2025: A Guide to Advancing Your Tech Career,https://www.datacamp.com/blog/top-ai-certifications,Artificial Intelligence,blog,2025-04-10
Oluseye Jeremiah,Git vs. GitHub: Differences Every Developer Should Know,https://www.datacamp.com/blog/git-vs-github,Git,blog,2025-04-10
Vikash Singh,AWS Security Best Practices: Key Strategies for Cloud Safety,https://www.datacamp.com/tutorial/aws-security-best-practices,AWS,blog,2025-04-10
Javier Canales Luna,Excel Table: The Essential Tool for Organizing Data,https://www.datacamp.com/tutorial/excel-table,Excel,blog,2025-04-10
Abid Ali Awan,Fine-Tuning Llama 4: A Guide With Demo Project,https://www.datacamp.com/tutorial/fine-tuning-llama-4,Artificial Intelligence,blog,2025-04-10
Vinod Chugani,AI in HR: Shaping the Future of Talent Management,https://www.datacamp.com/blog/ai-in-hr,Artificial Intelligence,blog,2025-04-10
Bex Tuychiev,Hadoop vs Spark: Which Big Data Framework Is Right For You?,https://www.datacamp.com/blog/hadoop-vs-spark,Hadoop,blog,2025-04-09
Maria Eugenia Inzaugarat,Top 30 Scala Interview Questions and Answers for 2025,https://www.datacamp.com/blog/scala-interview-questions,Scala,blog,2025-04-09
DataCamp Team,Introducing the State of Data & AI Literacy Report 2025,https://www.datacamp.com/blog/introducing-the-state-of-data-and-ai-literacy-report-2025,Data Literacy,blog,2025-04-09
Bex Tuychiev,Kafka Streams Tutorial: Introduction to Real-Time Data Processing,https://www.datacamp.com/tutorial/kafka-streams-tutorial,Kafka,blog,2025-04-09
Benito Martin,"Recursion in Python: Concepts, Examples, and Tips",https://www.datacamp.com/tutorial/recursion-in-python,Python,blog,2025-04-09
François Aubry,Manus AI: A Guide With 5 Practical Examples,https://www.datacamp.com/tutorial/manus-ai,Artificial Intelligence,blog,2025-04-09
Bex Tuychiev,OpenAI Responses API: The Ultimate Developer Guide,https://www.datacamp.com/tutorial/openai-responses-api,OpenAI,blog,2025-04-08
Allan Ouko,Excel Dark Mode: A Smarter Way to Work in Low Light,https://www.datacamp.com/tutorial/dark-mode-excel,Excel,blog,2025-04-08
DataCamp Team,Microsoft Turns 50—Join the World Record-Breaking AI Learning Fest!,https://www.datacamp.com/blog/microsoft-turns-50-join-the-world-record-breaking-ai-learning-fest,Artificial Intelligence,blog,2025-04-08
Matt David,DataCamp's New Learn to Prompt Experience,https://www.datacamp.com/blog/new-learn-to-prompt-experience,ChatGPT,blog,2025-04-08
Mark Pedigo,Git Remote: A Complete Guide with Examples,https://www.datacamp.com/tutorial/git-remote,Git,blog,2025-04-08
Elena Kosourova,RStudio Tutorial,https://www.datacamp.com/tutorial/r-studio-tutorial,R,blog,2025-04-07
Dhiraj Kumar,Top 37 Azure Data Engineering Interview Questions for 2025,https://www.datacamp.com/blog/azure-data-engineering-interview-questions,Azure,blog,2025-04-07
Alex Olteanu,"Meta's Llama 4: Features, Access, How It Works, and More ",https://www.datacamp.com/blog/llama-4,Artificial Intelligence,blog,2025-04-07
Patrick Brus,"GitFlow Tutorial: Branching for Features, Releases, and Hotfixes",https://www.datacamp.com/tutorial/gitflow,Git,blog,2025-04-06
Sejal Jaiswal,Multilayer Perceptrons in Machine Learning: A Comprehensive Guide,https://www.datacamp.com/tutorial/multilayer-perceptrons-in-machine-learning,Machine Learning,blog,2025-04-05
Derrick Mwiti,How to Use Python Decorators (With Function and Class-Based Examples),https://www.datacamp.com/tutorial/decorators-python,Python,blog,2025-04-04
Adejumo Ridwan Suleiman,Power BI Tooltips: Enhance Reports with Interactive Insights,https://www.datacamp.com/tutorial/power-bi-tooltips,Power BI,blog,2025-04-04
Elena Kosourova,PivotTable Conditional Formatting: Two Good Methods,https://www.datacamp.com/tutorial/pivot-table-conditional-formatting,Excel,blog,2025-04-04
Oluseye Jeremiah,Python Dunder Methods: Special Commands Worth Knowing,https://www.datacamp.com/tutorial/python-dunder-methods,Python,blog,2025-04-04
Dario Radečić,Cron Jobs in Data Engineering: How to Schedule Data Pipelines,https://www.datacamp.com/tutorial/cron-job-in-data-engineering,Data Engineering,blog,2025-04-04
Amberle McKee,Euler's Number (e) Explained: Its Significance and Applications,https://www.datacamp.com/tutorial/eulers-number,Data Science,blog,2025-04-03
Laiba Siddiqui,How to Lock Cells in Excel: Step-by-Step Guide to Protecting Your Data,https://www.datacamp.com/tutorial/how-to-lock-cells-in-excel,Excel,blog,2025-04-03
François Aubry,Runway Gen 4: A Guide With Practical Examples,https://www.datacamp.com/tutorial/runway-gen-4,Artificial Intelligence,blog,2025-04-03
Amberle McKee,The Lorenz Curve: A Great Way to Visualize Inequality,https://www.datacamp.com/tutorial/lorenz-curve,Data Science,blog,2025-04-03
Arun Nanda,"Azure Storage Explorer: Connect, Upload, and Organize Files",https://www.datacamp.com/tutorial/azure-storage-explorer,Azure,blog,2025-04-02
François Aubry,Gemini Image Editing: A Guide With 10 Practical Examples,https://www.datacamp.com/tutorial/gemini-image-editing,Artificial Intelligence,blog,2025-04-02
Arun Nanda,"Azure Blob Storage: How to Upload, Secure, and Manage Your Data",https://www.datacamp.com/tutorial/azure-blob-storage,Azure,blog,2025-04-02
Oluseye Jeremiah,How to Make a Pie Chart in Excel: The Steps Explained,https://www.datacamp.com/tutorial/pie-chart-in-excel,Excel,blog,2025-04-02
Laiba Siddiqui,Central Limit Theorem: A Key Concept in Statistics Explained,https://www.datacamp.com/tutorial/central-limit-theorem,Data Science,blog,2025-04-02
Laiba Siddiqui,"Top 18 Docker Commands to Build, Run, and Manage Containers",https://www.datacamp.com/blog/docker-commands,Docker,blog,2025-04-01
Aashi Dutt,LangManus: A Guide With Demo Project,https://www.datacamp.com/tutorial/langmanus,Artificial Intelligence,blog,2025-04-01
Marie Fayard,v0 by Vercel: A Guide With Demo Project,https://www.datacamp.com/tutorial/vercel-v0,Artificial Intelligence,blog,2025-04-01
Khalid Abdelaty,Git Status: How To Track Changes in Your Project with Confidence,https://www.datacamp.com/tutorial/git-status,Git,blog,2025-04-01
Don Kaluarachchi,Amazon EMR: A Complete Hands-On Guide for Beginners,https://www.datacamp.com/tutorial/amazon-emr,AWS,blog,2025-04-01
Gus Frazer,The Top Azure Synapse Interview Questions in 2025,https://www.datacamp.com/blog/azure-synapse-interview-questions,Azure,blog,2025-03-31
Javier Canales Luna,10 Top Data Analytics Conferences for 2025,https://www.datacamp.com/blog/top-data-analytics-conferences,Data Analysis,blog,2025-03-30
Kevin Babitz,Top 10 Deep Learning Conferences For 2025,https://www.datacamp.com/blog/top-deep-learning-conferences,Deep Learning,blog,2025-03-30
Kevin Babitz,Top 10 AI Conferences for 2025,https://www.datacamp.com/blog/top-ai-conferences,Artificial Intelligence,blog,2025-03-30
Vinod Chugani,How to Create an Amortization Schedule in Excel: The Steps Explained,https://www.datacamp.com/tutorial/amortization-schedule-excel,Excel,blog,2025-03-29
Laiba Siddiqui,Excel MATCH() Function: How to Find the Position of a Value in a Range,https://www.datacamp.com/tutorial/excel-match,Excel,blog,2025-03-29
Allan Ouko,How to Sort in Excel: A Step-by-Step Guide for Organizing Your Data,https://www.datacamp.com/tutorial/how-to-sort-in-excel,Excel,blog,2025-03-29
Sejal Jaiswal,Python List index() Method Explained with Examples,https://www.datacamp.com/tutorial/python-list-index,Python,blog,2025-03-28
Nishant Kumar,"Python Modules Tutorial: Importing, Writing, and Using Them",https://www.datacamp.com/tutorial/modules-in-python,Python,blog,2025-03-28
Abid Ali Awan,Gemini 2.5 Pro API: A Guide With Demo Project,https://www.datacamp.com/tutorial/gemini-2-5-pro-api,Artificial Intelligence,blog,2025-03-28
